{
  "$schema": "../schema/overlay.schema.json",
  "base": "qubite-english-base",
  "base_version": 1,
  "start": { "level": "a1", "lesson": "a1-m1-l1", "source": "placement" },
  "interests": ["programming", "olympiads", "games"],
  "daily_minutes": 15,
  "ops": [
    {
      "id": "feed-0001",
      "op": "skip",
      "by": "person",
      "at": "2026-10-23T16:05:00+05:00",
      "reason_ru": "Сказал: «В кафе заказывать умею, был в Лондоне». Нейт проверил двумя фразами — правда.",
      "lesson": "a1-m3-l3"
    },
    {
      "id": "feed-0002",
      "op": "note",
      "by": "agent",
      "at": "2026-10-24T18:40:00+05:00",
      "reason_ru": "В 4 уроках подряд пропускал -s у he/she.",
      "lesson": "a1-m1-l2",
      "note_ru": "Теряет -s у he/she (7 раз за неделю). В каждом задании этого урока отдельно отмечать хвостик -s; хвалить, когда сам исправляет."
    },
    {
      "id": "feed-0003",
      "op": "add_tasks",
      "by": "agent",
      "at": "2026-10-24T18:41:00+05:00",
      "reason_ru": "Добавил тренировку -s на темах, которые ему интересны.",
      "lesson": "a1-m1-l2",
      "tasks": [
        {
          "id": "t101",
          "type": "fill",
          "skill": "grammar",
          "ask_ru": "Поставь глагол в нужную форму — про олимпиадника.",
          "text": "Max ___ (solve) three problems a day and ___ (watch) Codeforces streams. He ___ (go) to bed late.",
          "answers": ["solves", "watches", "goes"]
        },
        {
          "id": "t102",
          "type": "speak",
          "skill": "speaking",
          "ask_ru": "Расскажи о дне сильного программиста, которого знаешь, — 5 фраз с he/she.",
          "mode": "answer",
          "say": "Tell me about a strong programmer you know. Five sentences with he or she.",
          "example": "My friend Artyom codes every day. He gets up at seven and solves one problem before school. He trains with a coach on Saturdays.",
          "must_use": ["he"]
        }
      ]
    },
    {
      "id": "feed-0004",
      "op": "repeat",
      "by": "agent",
      "at": "2026-10-27T19:00:00+05:00",
      "reason_ru": "После модуля -s всё ещё теряется — повторим урок после «Как часто?».",
      "lesson": "a1-m1-l2",
      "after": "a1-m1-l4",
      "focus_ru": "Только -s у he/she: короткий повтор на 7 минут."
    },
    {
      "id": "feed-0005",
      "op": "swap_theme",
      "by": "agent",
      "at": "2026-11-02T17:20:00+05:00",
      "reason_ru": "Урок про рецепт → «рецепт = алгоритм»: та же грамматика (повелительное, First/Then), но про код. Готовить не любит, код — любит.",
      "lesson": "a1-m3-l4",
      "theme": "programming",
      "words": [
        {
          "en": "step",
          "ru": "шаг",
          "example_en": "Step one: read the input.",
          "example_ru": "Шаг первый: считай входные данные."
        },
        {
          "en": "read the input",
          "ru": "считать входные данные",
          "example_en": "First, read the input.",
          "example_ru": "Сначала считай вход."
        },
        {
          "en": "loop",
          "ru": "цикл",
          "example_en": "Then loop through the array.",
          "example_ru": "Потом пройди циклом по массиву."
        },
        {
          "en": "check",
          "ru": "проверить",
          "example_en": "Check if the number is even.",
          "example_ru": "Проверь, чётное ли число."
        },
        {
          "en": "print the answer",
          "ru": "вывести ответ",
          "example_en": "Finally, print the answer.",
          "example_ru": "В конце выведи ответ."
        },
        {
          "en": "add one to",
          "ru": "прибавить один к",
          "example_en": "Add one to the counter.",
          "example_ru": "Прибавь один к счётчику."
        }
      ],
      "tasks": [
        {
          "id": "t7",
          "type": "describe_image",
          "skill": "speaking",
          "ask_ru": "Блок-схема простого алгоритма. Объясни шаги с First / Then / Finally.",
          "image": {
            "prompt_en": "A simple flowchart: start, read a number N, a loop box 'for each number from 1 to N', a diamond 'is it even?', yes arrow to 'add one to counter', end with 'print counter', clean flat diagram with arrows and icons, minimal text",
            "alt_ru": "Блок-схема: старт → считать N → цикл от 1 до N → «чётное?» → да: прибавить 1 к счётчику → вывести счётчик."
          },
          "say": "Explain this algorithm step by step.",
          "must_use": ["First", "Then", "Finally"],
          "min_sentences": 4,
          "example": "First, read the number N. Then loop through all numbers from one to N. Check if the number is even. If it is, add one to the counter. Finally, print the counter."
        },
        {
          "id": "t8",
          "type": "speak",
          "skill": "speaking",
          "ask_ru": "Объясни Нейту алгоритм своей любимой простой задачи — повелительными шагами.",
          "mode": "answer",
          "say": "Teach me an algorithm. Step by step. I'm a terrible programmer.",
          "example": "First, read the array. Then sort it. After that, take the first and the last numbers. Finally, print their sum.",
          "must_use": ["First", "Then"]
        }
      ],
      "talk_questions_en": [
        "What's the easiest algorithm you know?",
        "How do you explain code to a friend?",
        "What was the last problem you solved?"
      ]
    },
    {
      "id": "feed-0006",
      "op": "insert",
      "by": "agent",
      "at": "2026-11-05T18:00:00+05:00",
      "reason_ru": "Хочет читать условия на Codeforces — свой урок сразу после «Я умею».",
      "after": "a1-m4-l1",
      "lesson": {
        "id": "my-codeforces-statements",
        "level": "a1",
        "module": "a1-m4",
        "detail": "detailed",
        "title": { "ru": "Читаем условие задачи", "en": "Reading a problem statement" },
        "goal_ru": "После урока ты сможешь понять простое условие задачи на Codeforces без переводчика.",
        "can_do_en": "I can understand a simple problem statement in English.",
        "minutes": 15,
        "theme": "programming",
        "interests": ["olympiads"],
        "words": [
          {
            "en": "input / output",
            "ru": "входные / выходные данные",
            "example_en": "The first line of the input contains n.",
            "example_ru": "Первая строка входа содержит n."
          },
          {
            "en": "integer",
            "ru": "целое число",
            "example_en": "n is an integer.",
            "example_ru": "n — целое число."
          },
          {
            "en": "contain",
            "ru": "содержать",
            "example_en": "Each line contains two numbers.",
            "example_ru": "Каждая строка содержит два числа."
          },
          {
            "en": "find / print",
            "ru": "найти / вывести",
            "example_en": "Find the sum and print it.",
            "example_ru": "Найдите сумму и выведите её."
          },
          {
            "en": "at most / at least",
            "ru": "не больше / не меньше",
            "example_en": "n is at most 100.",
            "example_ru": "n не больше 100."
          },
          {
            "en": "test case",
            "ru": "тест, набор входных данных",
            "example_en": "There are t test cases.",
            "example_ru": "Дано t тестов."
          }
        ],
        "grammar": {
          "title_ru": "Present Simple и повелительное в условиях задач",
          "explain_ru": "Условия пишут в Present Simple (The input contains…, Each line has…) и командами (Find…, Print…, Output…). Пассив встречается, но его можно понимать по ключевым словам: is given — дано.",
          "explain_en": "Statements use the Present Simple (The input contains…) and imperatives (Find…, Print…). 'is given' means 'дано'.",
          "examples": [
            { "en": "You are given an array of n integers.", "ru": "Дан массив из n целых чисел." },
            { "en": "Print the maximum element.", "ru": "Выведите максимальный элемент." }
          ],
          "mistakes": [
            {
              "wrong": "at most = «как минимум»",
              "right": "at most = «не больше»",
              "why_ru": "Частая путаница: at most — верхняя граница."
            }
          ],
          "tutor_notes_ru": "Брать реальные простые условия (Div. 4, задача A). Ученик пересказывает условие своими словами по-английски, потом по-русски — проверяем понимание."
        },
        "phrases": [
          { "en": "You are given…", "ru": "Дано…" },
          { "en": "It is guaranteed that…", "ru": "Гарантируется, что…" }
        ],
        "talk": {
          "topics_ru": ["последняя решённая задача", "любимый тип задач"],
          "questions_en": [
            "What does this problem ask you to do?",
            "What is the input?",
            "What do you have to print?"
          ],
          "tutor_notes_ru": "Нейт даёт условие, ученик объясняет его своими словами и называет идею решения."
        },
        "tasks": [
          {
            "id": "t1",
            "type": "match",
            "skill": "vocab",
            "ask_ru": "Соедини слово и перевод.",
            "pairs": [
              { "en": "integer", "ru": "целое число" },
              { "en": "at most", "ru": "не больше" },
              { "en": "contain", "ru": "содержать" },
              { "en": "test case", "ru": "тест" }
            ]
          },
          {
            "id": "t2",
            "type": "translate",
            "skill": "reading",
            "ask_ru": "Переведи условие на русский.",
            "from": "en",
            "text": "You are given n integers. Print the sum of the even ones. It is guaranteed that n is at most 100.",
            "answers": [
              "Дано n целых чисел. Выведите сумму чётных. Гарантируется, что n не больше 100."
            ]
          },
          {
            "id": "t3",